{
  "name": "open_residual_obstruction",
  "description": "H_R is nonzero.",
  "dimensions": {
    "C": 1,
    "R": 2,
    "G": 1,
    "H": 1
  },
  "d1": [
    [
      0
    ],
    [
      0
    ]
  ],
  "d2": [
    [
      1,
      0
    ]
  ],
  "d3": [
    [
      0
    ]
  ],
  "nano_gap_gates": [
    {
      "gate_id": "G0",
      "gamma": 0.1,
      "epsilon": 0.02
    }
  ]
}